{
  "$schema": "https://json-schema.org/draft/2020-12/schema",
  "$id": "https://schemas.automated-ai-research.org/v1/report-manifest.schema.json",
  "title": "ReportManifest",
  "description": "Provenance for a generated report. A draft is visibly a draft and can never be published.",
  "type": "object",
  "required": [
    "schema_name",
    "schema_version",
    "artifact_id",
    "artifact_hash",
    "created_at",
    "created_by",
    "run_id",
    "report_path",
    "report_sha256",
    "draft"
  ],
  "properties": {
    "schema_name": {
      "type": "string"
    },
    "schema_version": {
      "type": "string",
      "pattern": "^\\d+\\.\\d+\\.\\d+$"
    },
    "artifact_id": {
      "type": "string",
      "minLength": 1
    },
    "artifact_hash": {
      "type": "string",
      "pattern": "^sha256:[0-9a-f]{64}$"
    },
    "created_at": {
      "type": "string",
      "minLength": 1
    },
    "created_by": {
      "type": "object",
      "required": [
        "actor_type"
      ],
      "properties": {
        "actor_type": {
          "enum": [
            "cli",
            "host_agent",
            "human"
          ]
        },
        "host": {
          "type": "string"
        },
        "model_identifier": {
          "type": "string"
        }
      },
      "not": {
        "required": [
          "reasoning_trace"
        ]
      }
    },
    "run_id": {
      "type": "string",
      "pattern": "^RUN-[0-9a-fA-F-]{36}$"
    },
    "report_path": {
      "type": "string"
    },
    "report_sha256": {
      "type": "string",
      "pattern": "^sha256:[0-9a-f]{64}$"
    },
    "draft": {
      "type": "boolean"
    },
    "validation_result_hash": {
      "anyOf": [
        {
          "type": "string",
          "pattern": "^sha256:[0-9a-f]{64}$"
        },
        {
          "type": "null"
        }
      ]
    },
    "claim_ids": {
      "type": "array",
      "items": {
        "type": "string",
        "pattern": "^CLM-[0-9a-fA-F-]{36}$"
      }
    },
    "evidence_ids": {
      "type": "array",
      "items": {
        "type": "string",
        "pattern": "^EVD-sha256-[0-9a-f]{64}$"
      }
    },
    "citation_index": {
      "type": "array",
      "items": {
        "type": "object"
      }
    },
    "retrieval_log_hashes": {
      "type": "array",
      "items": {
        "type": "string",
        "pattern": "^sha256:[0-9a-f]{64}$"
      }
    },
    "schema_versions_used": {
      "type": "object"
    },
    "disclosures": {
      "type": "array",
      "items": {
        "type": "string"
      }
    }
  },
  "additionalProperties": false,
  "allOf": [
    {
      "$comment": "Spec §8.9: a draft must not claim validation. A published report must name the validation result it rests on.",
      "if": {
        "properties": {
          "draft": {
            "const": false
          }
        }
      },
      "then": {
        "required": [
          "validation_result_hash"
        ],
        "properties": {
          "validation_result_hash": {
            "type": "string",
            "pattern": "^sha256:[0-9a-f]{64}$"
          }
        }
      }
    }
  ]
}
