{
  "schema_name": "ReportManifest",
  "schema_version": "1.0.0",
  "artifact_id": "RUN-7eb7704a-e2b4-42fd-b1f9-9abb2dab282a",
  "created_at": "2026-07-26T07:21:20Z",
  "created_by": {
    "actor_type": "cli"
  },
  "run_id": "RUN-7eb7704a-e2b4-42fd-b1f9-9abb2dab282a",
  "report_path": "runs/RUN-7eb7704a-e2b4-42fd-b1f9-9abb2dab282a/report/report.md",
  "report_sha256": "sha256:7ba080e68cb3d0e3caf53184c0fac4dff1fe99ffda0fc9818062e5267bb91b2e",
  "draft": false,
  "validation_result_hash": "sha256:c16d0dad5e21129a784b40082e92c87a3bff020bf5b8a66284f76fe8fc5d6f17",
  "claim_ids": [
    "CLM-019f9d4b-05ac-70df-b8ab-e25dfe81e092"
  ],
  "evidence_ids": [
    "EVD-sha256-a460a2a10e9576135a184c4036d1b1686848fda59a2ed8decee2df44f637a12f"
  ],
  "citation_index": [
    {
      "ref": 1,
      "evidence_id": "EVD-sha256-a460a2a10e9576135a184c4036d1b1686848fda59a2ed8decee2df44f637a12f",
      "document_id": "DOC-sha256-37de79c621d3efac6d05dea9154a92162429d5b26c83e145f60d055ec72359a5",
      "document_version_id": "DVER-sha256-861883b8735efcf657b76681a42d97f7dbc980dacc2103bd9ecd2fd630aad9d5",
      "source": "pim-primary-study-copy.pdf",
      "position": "page 2, 1 Introduction. This report evaluates a process-in-memory configuration."
    }
  ],
  "schema_versions_used": {
    "Claim": "1.0.0",
    "Evidence": "1.0.0",
    "Review": "1.0.0",
    "ValidationResult": "1.0.0"
  },
  "disclosures": [
    "3 document(s) contain unreadable pages"
  ],
  "artifact_hash": "sha256:94e8429c9102fb49b7c5b6fd2a538d0e425574976208c60c2ac1a7045fbec1f4"
}
